Iron Toxicity,Rare,0,100,both,Nausea,vomiting,Abdominal Pain,diarrhea,lethargy,weakness,organ damage in severe cases,,,,,,,,,,,,,,,,,,
Irritable Bowel Syndrome,Common,20,60,both,Abdominal Pain,bloating,gas,Constipation,mucus in stool,Frequent bowel movements,,Diarrhea,,,,,,,,,,,,,,,,,
Isosporiasis,Rare,0,100,both,Poor feeding,vomiting,developmental delay,seizures,metabolic acidosis,,,,,,,,,,,,,,,,,,,,
Isovaleric Acidemia,Rare,0,100,both,Fever,headache,muscle pain,nausea,vomiting,weakness,,,,,,,,,,,,,,,,,,,
Japanese Encephalitis Vaccination,Uncommon,0,100,both,Joint pain,swelling,stiffness,limping,decreased range of motion,fever,,,,,,,,,,,,,,,,,,,
Juvenile Idiopathic Arthritis,Common,0,18,both,Progressive loss of motor skills,muscle weakness,developmental regression,seizures,,,,,,,,,,,,,,,,,,,,,
Juvenile Metachromatic Leukodystrophy,Very rare,0,18,both,Anemia,thrombocytopenia,enlarged liver,recurrent infections,poor weight gain,Enlarged spleen,,,,,,,,,,,,,,,,,,,
Juvenile Myelomonocytic Leukemia,Rare,0,18,both,Fatigue,weakness,fever,Paleness,easy bruising,enlarged liver,Easy bleeding,Enlarged spleen,,,,,,,,,,,,,,,,,
Kaposi's Sarcoma,Rare,20,80,both,Red or purple lesions on the skin,mouth,or internal organs,swelling,fever,weight loss,,,,,,,,,,,,,,,,,,,
Kaposi's Sarcoma Skin Lesion,Rare,20,80,both,Red or purple patches,plaques,Nodules,typically painless,,,,,,,,,,,,,,,,,,,,,
Kaposiform Hemangioendothelioma,Rare,0,100,both,Rapidly growing mass or lump,usually in the skin or soft tissue,bluish or purple color,,,,,,,,,,,,,,,,,,,,,,
Kawasaki Disease,Uncommon,0,5,both,High fever persisting for at least 5 days,rash,redness or swelling of the hands or feet,watery or bloodshot eyes,swollen lymph nodes,,,,,,,,,,,,,,,,,,,,
Keloid,Common,0,100,both,Overgrowth of scar tissue at the site of a healed skin injury,ranging from pink to dark brown in color,may itch or cause discomfort,,,,,,,,,,,,,,,,,,,,,,
Keratitis,Common,0,100,both,Eye pain,redness,blurred vision,Sensitivity to light (photophobia),excessive tearing,,,,,,,,,,,,,,,,,,,,
Keratoconjunctivitis,Common,0,100,both,Redness,irritation,burning sensation,discharge from the eyes,blurred vision,,,,,,,,,,,,,,,,,,,,
Keratoconjunctivitis Sicca,Common,0,100,both,Dryness,itching,burning sensation in the eyes,blurred vision,discomfort with contact lenses,,,,,,,,,,,,,,,,,,,,
Keratoderma,Uncommon,0,100,both,Thickening of the skin on the palms and soles,calluses,cracking,pain,,,,,,,,,,,,,,,,,,,,,
Keratosis Follicularis,Rare,0,100,both,Small,rough bumps on the skin,typically on the upper arms,thighs,buttocks,or face,,,,,,,,,,,,,,,,,,,
Kidney Disease With Reduction In Glomerular Filtration Rate (Gfr),Common,0,100,both,Fatigue,swelling in the legs,decreased urine output,shortness of breath,nausea,confusion,,,,,,,,,,,,,,,,,,,
Kidney Transplant Rejection,Rare,0,100,both,Decreased urine output,swelling in the legs or feet,high blood pressure,fatigue,weight gain,,,,,,,,,,,,,,,,,,,,
Klebsiella Complicated Appendicitis,Uncommon,0,100,both,Abdominal Pain,particularly in the lower right side,nausea,vomiting,fever,,,,,,,,,,,,,,,,,,,,
Klebsiella Complicated Uti,Uncommon,0,100,both,Frequent urge to urinate,pain or burning sensation during urination,blood in urine,pelvic discomfort,,,,,,,,,,,,,,,,,,,,,
Klebsiella Cystitis,Common,0,100,both,Frequent urge to urinate,pain or burning sensation during urination,blood in urine,,,,,,,,,,,,,,,,,,,,,,
Klebsiella Endometritis,Rare,0,100,both,Pelvic pain,abnormal vaginal bleeding,fever,"foul,smelling vaginal discharge",,,,,,,,,,,,,,,,,,,,,
Klebsiella Infection,Uncommon,0,100,both,Fever,chills,Coughing,shortness of breath,chest pain,confusion,septic shock in severe cases,,,,,,,,,,,,,,,,,,
Klebsiella Joint Infection,Rare,0,100,both,Joint pain,swelling,warmth,redness,limited range of motion,fever,,,,,,,,,,,,,,,,,,,
Klebsiella Lung Abscess,Very rare,0,100,both,Coughing,chest pain,difficulty breathing,fever,chills,night sweats,,,,,,,,,,,,,,,,,,,
Klebsiella Nosocomial Pneumonia,Rare,0,100,both,Fever,Coughing,difficulty breathing,chest pain,rapid heartbeat,,,,,,,,,,,,,,,,,,,,
Klebsiella Pelvic Inflammatory Disease,Rare,0,100,female,Pelvic pain,abnormal vaginal discharge,fever,pain during intercourse,irregular menstrual bleeding,,,,,,,,,,,,,,,,,,,,
Klebsiella Pneumonia,Rare,0,100,both,Coughing,difficulty breathing,chest pain,fever,chills,fatigue,,,,,,,,,,,,,,,,,,,
Klebsiella Pneumoniae Bronchitis,Uncommon,0,100,both,Coughing,phlegm production,chest discomfort,shortness of breath,fever,,,,,,,,,,,,,,,,,,,,
Klebsiella Pneumoniae Chronic Bronchitis,Rare,0,100,both,Coughing with sputum,wheezing,chest tightness,frequent respiratory infections,,,,,,,,,,,,,,,,,,,,,
Klebsiella Pneumoniae Osteomyelitis,Rare,0,100,both,Bone pain,swelling,warmth,redness,fever,,,,,,,,,,,,,,,,,,,,
Klebsiella Pneumoniae Peritonitis,Rare,0,100,both,Abdominal Pain,tenderness,distension,fever,nausea,vomiting,,,,,,,,,,,,,,,,,,,
Klebsiella Pneumoniae Septicemia,Rare,0,100,both,Fever,chills,rapid breathing,rapid heart rate,confusion,low blood pressure,,,,,,,,,,,,,,,,,,,
Klebsiella Prostatitis,Rare,0,100,both,Pain in the pelvic region,difficulty urinating,unusual urinary urgency and frequency,fever,,,,,,,,,,,,,,,,,,,,,
Klebsiella Pyelonephritis,Rare,0,100,both,Flank pain,fever,chills,nausea,vomiting,blood in urine,,,,,,,,,,,,,,,,,,,
Klebsiella Septicemia,Rare,0,100,both,Fever,chills,rapid breathing,rapid heart rate,confusion,low blood pressure,,,,,,,,,,,,,,,,,,,
Klebsiella Urinary Tract Infection,Common,0,100,both,Frequent urge to urinate,pain or burning sensation during urination,blood in urine,pelvic discomfort,,,,,,,,,,,,,,,,,,,,,
Klinefelter's Syndrome,Common,20,80,male,Small testicles,reduced facial and body hair,enlarged breast tissue,infertility,,,,,,,,,,,,,,,,,,,,,
Knee Replacement Deep Vein Thrombosis Prevention,Uncommon,0,100,both,Pain,swelling,warmth,or redness in the leg,especially calf pain,difficulty walking,,,,,,,,,,,,,,,,,,,
Labial Adhesion,Rare,0,100,female,Fusion of the labia minora,urinary tract infections,difficulty urinating,recurrent infections,,,,,,,,,,,,,,,,,,,,,
Labor Pain,Common,0,100,female,Uterine contractions,back pain,abdominal cramping,pressure in the pelvis,,,,,,,,,,,,,,,,,,,,,
Lactation,Common,0,100,female,Breast engorgement,leaking breasts,nipple tenderness,uterine cramping during breastfeeding,,,,,,,,,,,,,,,,,,,,,
Lactose Intolerance,Common,0,100,both,Bloating,gas,diarrhea,nausea,stomach cramps after consuming dairy products,,,,,,,,,,,,,,,,,,,,
Lamellar Ichthyosis,Rare,0,100,both,Thick,scaly skin,dry skin,scaling of the skin resembling fish scales,,,,,,,,,,,,,,,,,,,,,
"Lamivudine,Refractory Chronic Hepatitis B",Uncommon,0,100,both,Fatigue,nausea,Abdominal Pain,Yellowing of the skin and eyes (jaundice),dark urine,liver enlargement,,,,,,,,,,,,,,,,,,,
Langerhans Cell Histiocytosis,Rare,0,100,both,Bone pain,rash,swelling,lesions on the skin,fever,weight loss,,,,,,,,,,,,,,,,,,,
Large Granular Lymphocytic Leukemia,Rare,20,80,both,Fatigue,weakness,frequent infections,enlarged lymph nodes,night sweats,,,,,,,,,,,,,,,,,,,,
Laryngeal Edema,Common,0,100,both,Hoarseness,difficulty breathing,throat pain,Coughing,stridor,difficulty swallowing,,,,,,,,,,,,,,,,,,,
,,,,,,,,,,,,,,,,,,,,,,,,,,,,,
,,,,,,,,,,,,,,,,,,,,,,,,,,,,,
,,,,,,,,,,,,,,,,,,,,,,,,,,,,,
,,,,,,,,,,,,,,,,,,,,,,,,,,,,,
,,,,,,,,,,,,,,,,,,,,,,,,,,,,,
Lateral Canthal Lines,Very rare,0,100,both,Fine lines that extend from the outer corner of the eyes (lateral canthus) toward the temples,associated with aging,,,,,,,,,,,,,,,,,,,,,,,
Lead Toxicity,Uncommon,0,100,both,Abdominal Pain,constipation,headache,memory loss,fatigue,tingling or numbness in extremities,,,,,,,,,,,,,,,,,,,
Left Ventricular Dysfunction Following Myocardial Infarction,Uncommon,40,80,both,Shortness of breath,fatigue,swelling in the legs,rapid or irregular heartbeat,,,,,,,,,,,,,,,,,,,,,
Legionella Pneumophila Pneumonia,Rare,0,100,both,Fever,Coughing,shortness of breath,muscle aches,headache,,,,,,,,,,,,,,,,,,,,
Legionnaires' Disease,Uncommon,0,100,both,Fever,Coughing,chills,muscle aches,headache,shortness of breath,chest pain,,,,,,,,,,,,,,,,,,
Leiomyosarcoma,Rare,20,80,both,Abdominal Pain,blood in stool,fatigue,Weight loss,,,,,,,,,,,,,,,,,,,,,
Leishmaniasis,Uncommon,0,100,both,Skin sores,ulcers,fever,weight loss,enlarged spleen,Enlarged liver,,,,,,,,,,,,,,,,,,,
"Lennox,Gastaut Epilepsy",Uncommon,0,18,both,Multiple seizure types (such as tonic,atonic,Seizures,developmental regression,cognitive impairment,behavioral problems,,,,,,,,,,,,,,,,,,,
"Lennox,Gastaut Syndrome Treatment Adjunct",Rare,0,18,both,"Additional treatment administered alongside primary therapy for Lennox,Gastaut syndrome",such as ketogenic diet,vagus nerve stimulation,or specific antiepileptic medications,,,,,,,,,,,,,,,,,,,,,
Leprosy,Rare,0,100,both,Skin lesions with decreased sensation,enlarged nerves,muscle weakness,loss of digits,facial deformities,blindness,loss of sensation,,,,,,,,,,,,,,,,,,
Leptospirosis,Uncommon,0,100,both,High fever,headache,muscle pain,chills,red eyes,Abdominal Pain,diarrhea,Yellowing of the skin and eyes (jaundice),rash,Coughing,shortness of breath,,,,,,,,,,,,,,
"Letterer,Siwe Disease",Very rare,0,5,both,Rash,enlarged liver,Enlarged lymph nodes,anemia,thrombocytopenia,bone lesions,failure to thrive,Lesions,Enlarged spleen,,,,,,,,,,,,,,,,
Leukopenia,Common,0,100,both,Recurrent infections (bacterial,viral,fungal),fatigue,weakness,fever,chills,sore throat,mouth sores,enlarged lymph nodes,,,,,,,,,,,,,,,
Lichen Planus,Common,0,100,both,Itchy,purple,Papules,often on wrists,ankles,lower back,and genitalia,,,,,,,,,,,,,,,,,,
Lichen Simplex Chronicus,Common,0,100,both,Thickened,leathery,darkened skin,often due to chronic scratching or rubbing,,,,,,,,,,,,,,,,,,,,,
"Life,Threatening Ventricular Tachycardia",Uncommon,40,80,both,Rapid heart rate,dizziness,fainting,chest pain,shortness of breath,,,,,,,,,,,,,,,,,,,,
Lipodystrophy Associated With Human Immunodeficiency Virus Infection,Rare,0,100,both,Fat redistribution (loss of fat from limbs and face,accumulation in abdomen and upper back),insulin resistance,hyperlipidemia,,,,,,,,,,,,,,,,,,,,,
Liposarcoma,Rare,20,80,both,Painful lump or swelling in soft tissue,typically in the extremities or abdomen,,,,,,,,,,,,,,,,,,,,,,,
Listeria Endocarditis,Very rare,0,100,both,Fever,fatigue,shortness of breath,new or changing heart murmurs,,,,,,,,,,,,,,,,,,,,,
Listeria Meningitis,Very rare,0,100,both,Headache,fever,stiff neck,nausea,vomiting,confusion,Sensitivity to light (photophobia),,,,,,,,,,,,,,,,,,
Listeria Monocytogenes Septicemia,Very rare,0,100,both,Fever,chills,weakness,confusion,rapid breathing,rapid heart rate,,,,,,,,,,,,,,,,,,,
Listeria Osteomyelitis,Very rare,0,100,both,Bone pain,swelling,warmth,redness,fever,chills,,,,,,,,,,,,,,,,,,,
Listeria Septic Arthritis,Very rare,0,100,both,Joint pain,swelling,warmth,redness,limited range of motion,fever,,,,,,,,,,,,,,,,,,,
Listeriosis,Very rare,0,100,both,Fever,muscle aches,nausea,vomiting,diarrhea,headache,stiff neck,,,,,,,,,,,,,,,,,,
Liver Abscess,Uncommon,0,100,both,Abdominal Pain,fever,chills,nausea,vomiting,Yellowing of the skin and eyes (jaundice),,,,,,,,,,,,,,,,,,,
Liver Abscess Amebiasis Due To Entamoeba Histolytica,Rare,0,100,both,Abdominal Pain,fever,chills,nausea,vomiting,weight loss,,,,,,,,,,,,,,,,,,,
Liver Cell Carcinoma,Common,40,80,both,Abdominal Pain,weight loss,Yellowing of the skin and eyes (jaundice),fatigue,abdominal swelling,,,,,,,,,,,,,,,,,,,,
Liver Transplant Rejection,Rare,0,100,both,Fever,Yellowing of the skin and eyes (jaundice),Abdominal Pain,fatigue,nausea,vomiting,,,,,,,,,,,,,,,,,,,
Local Anesthesia Adjunct,Uncommon,0,100,both,Reduced pain sensation,numbness,tingling,muscle weakness,,,,,,,,,,,,,,,,,,,,,
Local Anesthesia For Endotracheal Intubation,Uncommon,0,100,both,Decreased sensation in the throat,reduced cough reflex,decreased gag reflex,,,,,,,,,,,,,,,,,,,,,,
Local Anesthesia For Ophthalmologic Procedure,Uncommon,0,100,both,Numbness,reduced pain sensation,reduced tear production,eye pressure sensation,,,,,,,,,,,,,,,,,,,,,
Local Anesthesia For Procedure,Common,0,100,both,Numbness,reduced pain sensation,tingling,muscle weakness at the site of the procedure,,,,,,,,,,,,,,,,,,,,,
Local Anesthesia For Procedure On Or Through Nasal Cavity,Uncommon,0,100,both,Numbness,reduced pain sensation in the nasal cavity or adjacent areas,,,,,,,,,,,,,,,,,,,,,,,
Local Anesthesia For Urethral Pain,Uncommon,0,100,both,Reduction in pain sensation,numbness,tingling in the urethral area,,,,,,,,,,,,,,,,,,,,,,
Localized Malignant Tumor Of Anus,Rare,40,80,both,Anal pain,bleeding,itching,lump or mass near the anus,changes in bowel habits,,,,,,,,,,,,,,,,,,,,
Locally Advanced Breast Carcinoma,Uncommon,40,80,both,Breast lump,skin changes over breast,nipple discharge,nipple inversion,breast pain,,,,,,,,,,,,,,,,,,,,
Loffler Syndrome,Rare,0,100,both,Coughing,fever,chest pain,shortness of breath,malaise,weight loss,"infiltrates on chest X,ray",,,,,,,,,,,,,,,,,,
Loss Of Bone Mineral Density (Bmd) Due To Androgen Deprivation Therapy,Common,40,80,both,Bone pain,fractures,decreased height,stooped posture,,,,,,,,,,,,,,,,,,,,,
Loss Of Bone Mineral Density (Bmd) Due To Aromatase Inhibitor Therapy,Common,40,80,both,Bone pain,fractures,decreased height,stooped posture,,,,,,,,,,,,,,,,,,,,,
"Louse,Borne Typhus",Rare,0,100,both,Fever,headache,rash,muscle pain,joint pain,,,,,,,,,,,,,,,,,,,,
Low Cardiac Output,Uncommon,40,80,both,Fatigue,shortness of breath,weakness,fainting,confusion,,,,,,,,,,,,,,,,,,,,
Low Grade Glioma With Braf Fusion Or Mutation,Rare,20,80,both,Headache,seizures,visual disturbances,cognitive changes,weakness or numbness in limbs,,,,,,,,,,,,,,,,,,,,
Low Grade Glioma With Braf V600e Mutation,Rare,20,80,both,Headache,seizures,visual disturbances,cognitive changes,weakness or numbness in limbs,,,,,,,,,,,,,,,,,,,,
"Low,Grade Upper Tract Urothelial Cancer",Rare,40,80,both,Blood in urine,urinary urgency,frequent urination,flank pain,,,,,,,,,,,,,,,,,,,,,
Lower Limb Spasticity,Common,0,100,both,Muscle stiffness,muscle tightness,involuntary muscle spasms,,,,,,,,,,,,,,,,,,,,,,
Lower Respiratory Infection,Common,0,100,both,Coughing,chest congestion,fever,fatigue,difficulty breathing,,,,,,,,,,,,,,,,,,,,
Lung Abscess,Uncommon,0,100,both,Coughing,fever,chest pain,difficulty breathing,coughing up blood,coughing up mucus,,,,,,,,,,,,,,,,,,,
Lyme Arthritis,Rare,0,100,both,Joint pain,swelling,redness,warmth,stiffness,particularly in large joints like knees,,,,,,,,,,,,,,,,,,,
Lyme Carditis,Rare,0,100,both,Chest pain,shortness of breath,palpitations,fainting,dizziness,,,,,,,,,,,,,,,,,,,,
Lyme Disease,Common,0,100,both,Rash,fever,chills,fatigue,muscle and joint aches,,,,,,,,,,,,,,,,,,,,
Lyme Disease Of The Central Nervous System,Very rare,0,100,both,Headache,stiff neck,facial palsy,numbness or weakness in limbs,heart palpitations,,,,,,,,,,,,,,,,,,,,
Lyme Disease Prevention,Uncommon,0,100,both,Tick avoidance,wearing protective clothing,using insect repellents,checking for ticks after outdoor activities,,,,,,,,,,,,,,,,,,,,,
Lymph Node Positive Colorectal Carcinoma,Rare,40,80,both,Changes in bowel habits,rectal bleeding,abdominal pain,weaknes,Fatigue,,,,,,,,,,,,,,,,,,,,
Lymphangioleiomyomatosis,Rare,0,100,both,Shortness of breath,coughing,chest pain,recurrent lung infections,,,,,,,,,,,,,,,,,,,,,
Lymphoblastic Lymphoma,Rare,0,18,both,Enlarged lymph nodes,fever,weight loss,fatigue,easy bruising,Easy bleeding,,,,,,,,,,,,,,,,,,,
Lymphocutaneous Sporotrichosis,Uncommon,0,100,both,Skin lesions,usually on the hands or arms,that may ulcerate and become crusted,,,,,,,,,,,,,,,,,,,,,,
Lymphogranuloma Venereum,Uncommon,0,100,both,Painful,swollen lymph nodes in the groin,genital ulcers,rectal discharge or bleeding,swollen lymph nodes in the pelvis,,,,,,,,,,,,,,,,,,,,
Lymphoid Blast Phase Philadelphia Chromosome Positive Chronic Myelocytic Leukemia,Very rare,40,80,both,Fatigue,weakness,weight loss,enlarged spleen,bone pain,,,,,,,,,,,,,,,,,,,,
Lymphomatous Meningitis,Rare,40,80,both,Headache,nausea,vomiting,stiff neck,confusion,vision changes,,,,,,,,,,,,,,,,,,,
Lysosomal Acid Lipase Deficiency,Rare,0,100,both,Enlarged liver,failure to thrive,developmental delay,low muscle tone,Enlarged spleen,,,,,,,,,,,,,,,,,,,,
"Lysosomal Alpha,1,4,Glucosidase Deficiency",Very rare,0,100,both,Muscle weakness,hypotonia,enlarged tongue,respiratory difficulties,heart problems,,,,,,,,,,,,,,,,,,,,
Macrophage Activation Syndrome,Rare,0,100,both,Fever,swollen lymph nodes,rash,liver or spleen enlargement,neurologic symptoms,,,,,,,,,,,,,,,,,,,,
"Macular Edema Associated With Non,Infectious Uveitis",Uncommon,0,100,both,Blurred or decreased vision,distorted vision,floaters,eye pain,,,,,,,,,,,,,,,,,,,,,
Macular Edema Following Retinal Vein Occlusion,Common,0,100,both,Blurred or decreased vision,distorted vision,floaters,eye pain,,,,,,,,,,,,,,,,,,,,,
Maintain Patency Of Indwelling Intravenous Catheter,Common,0,100,both,Catheter blockage or malfunction,swelling or redness at the catheter site,inability to infuse fluids or medications,,,,,,,,,,,,,,,,,,,,,,
Maintenance Of Healing Duodenal Ulcer,Common,0,100,both,Abdominal Pain,bloating,nausea,vomiting,black or tarry stools,,,,,,,,,,,,,,,,,,,,
Maintenance Of Healing Erosive Esophagitis,Common,0,100,both,Heartburn,chest pain,difficulty swallowing,regurgitation of food or sour liquid,,,,,,,,,,,,,,,,,,,,,
Maintenance Of Healing Gastric Ulcer,Common,0,100,both,Abdominal Pain,bloating,nausea,vomiting,black or tarry stools,,,,,,,,,,,,,,,,,,,,
Maintenance Therapy For Asthma,Common,0,100,both,Coughing,wheezing,shortness of breath,chest tightness,,,,,,,,,,,,,,,,,,,,,
Major Depressive Disorder,Common,0,100,both,Persistent sadness,loss of interest or pleasure in activities,changes in appetite,fatigue,feelings of worthlessness or guilt,changes in weight,,,,,,,,,,,,,,,,,,,
,,,,,,,,,,,,,,,,,,,,,,,,,,,,,
Major Nerve Block For Surgery,Common,0,100,both,Numbness or reduced sensation in a large area of the body,pain relief during and after surgery,,,,,,,,,,,,,,,,,,,,,,,
Malaria,Common,0,100,both,Fever,chills,sweats,headache,muscle aches,fatigue,nausea,vomiting,diarrhea,,,,,,,,,,,,,,,,
,,,,,,,,,,,,,,,,,,,,,,,,,,,,,
Male Hypogonadism,Common,20,80,male,Reduced libido,erectile dysfunction,fatigue,infertility,decreased muscle mass,loss of body hair,,,,,,,,,,,,,,,,,,,
Male Patterned Baldness,Common,20,80,male,Gradual thinning of hair on the scalp,receding hairline,bald spots or patches,,,,,,,,,,,,,,,,,,,,,,
Malignancy,Common,0,100,both,Varied depending on the type and location of cancer,Weight loss,fatigue,pain,changes in bowel habits,Coughing,difficulty swallowing,lumps or bumps under the skin,changes in bladder habits,,,,,,,,,,,,,,,,
Malignant Ascites,Rare,0,100,both,Abdominal swelling,discomfort or pain,shortness of breath,nausea,vomiting,,,,,,,,,,,,,,,,,,,,
Malignant Brain Neoplasm,Uncommon,20,80,both,Headache,seizures,nausea,vomiting,changes in vision,difficulty with balance or coordination,,,,,,,,,,,,,,,,,,,
Malignant Esophageal Neoplasm,Rare,40,80,both,Difficulty swallowing,pain or discomfort in the chest or upper abdomen,Weight loss,vomiting blood,,,,,,,,,,,,,,,,,,,,,
Malignant Esophageal Obstruction,Very rare,40,80,both,Difficulty swallowing,feeling of food getting stuck in the throat,pain or discomfort in the chest or upper abdomen,,,,,,,,,,,,,,,,,,,,,,
Malignant Essential Hypertension,Uncommon,40,80,both,High blood pressure that is difficult to control,Headache,chest pain,shortness of breath,visual changes,,,,,,,,,,,,,,,,,,,,
Malignant Gastroenteropancreatic Neuroendocrine Tumor,Uncommon,40,80,both,Abdominal Pain,changes in bowel habits,Weight loss,nausea,vomiting,,,,,,,,,,,,,,,,,,,,
Malignant Glaucoma,Rare,40,80,both,Increased intraocular pressure,eye pain,blurred vision,halos around lights,redness in the eye,,,,,,,,,,,,,,,,,,,,
Malignant Glioma,Uncommon,40,80,both,Headache,seizures,nausea,vomiting,changes in vision,cognitive changes,weakness or numbness in limbs,,,,,,,,,,,,,,,,,,
Malignant Hyperthermia,Rare,0,100,both,Rapid rise in body temperature,muscle rigidity,Rapid heart rate,rapid breathing,sweating,dark urine,,,,,,,,,,,,,,,,,,,
,,,,,,,,,,,,,,,,,,,,,,,,,,,,,
Malignant Melanoma,Common,20,80,both,Changes in the size shape  color  or texture of a mole or other skin lesion,,,,,,,,,,,,,,,,,,,,,,,,
,,,,,,,,,,,,,,,,,,,,,,,,,,,,,
,,,,,,,,,,,,,,,,,,,,,,,,,,,,,
,,,,,,,,,,,,,,,,,,,,,,,,,,,,,
Malignant Mesothelioma Of Pleura,Rare,40,80,both,Chest pain,shortness of breath,Coughing,fatigue,Weight loss,,,,,,,,,,,,,,,,,,,,
Malignant Neoplasm Of Gastroesophageal Junction,Uncommon,40,80,both,Difficulty swallowing,chest pain,heartburn,nausea,vomiting,Weight loss,,,,,,,,,,,,,,,,,,,
Malignant Neoplasm Of Liver,Common,40,80,both,Abdominal Pain,swelling in the abdomen,Yellowing of the skin and eyes (jaundice),nausea,vomiting,Weight loss,,,,,,,,,,,,,,,,,,,
Malignant Neoplasm Of Lung,Common,40,80,both,Coughing,coughing up blood,chest pain,shortness of breath,fatigue,,,,,,,,,,,,,,,,,,,,
Malignant Neoplasm Of Ovary Associated With Germline Brca Mutation,Rare,20,80,female,Abdominal pain,bloating,feeling full quickly after eating,urinary urgency,changes in bowel habits,pelvic pain,,,,,,,,,,,,,,,,,,,
Malignant Neoplasm Of The Ovary,Common,20,80,female,abdominal pain,bloating,feeling full quickly after eating,urinary urgency,changes in bowel habits,pelvic pain,,,,,,,,,,,,,,,,,,,
Malignant Neoplasm Of The Uterus,Common,40,80,female,Abnormal vaginal bleeding,pelvic pain or pressure,pain during intercourse,feeling a mass in the pelvic area,,,,,,,,,,,,,,,,,,,,,
Malignant Perivascular Epithelioid Cell Tumor,Very rare,40,80,both,Depending on the location and size of the tumor: pain,swelling,mass,or pressure in affected area,,,,,,,,,,,,,,,,,,,,,
Malignant Solid Tumor With Braf V600e Mutation,Rare,40,80,both,Symptoms vary depending on the location of the tumor; may include pain,swelling,or other signs of tissue involvement,,,,,,,,,,,,,,,,,,,,,,
Malignant Tumor Of Testis,Rare,20,80,male,Lump or swelling in the testicle,testicular pain or discomfort,heaviness in the scrotum,,,,,,,,,,,,,,,,,,,,,,
Malignant Tumor Of Urinary Bladder,Common,40,80,both,blood in urine,pain during urination,frequent urination,unusual urinary urgency and frequency,,,,,,,,,,,,,,,,,,,,,
Mania Associated With Bipolar Disorder,Common,20,80,both,Euphoria,decreased need for sleep,racing thoughts,increased energy,reckless behavior,,,,,,,,,,,,,,,,,,,,
"Mania Associated With Bipolar Disorder, Adjunct Treatment",Common,20,80,both,Euphoria,decreased need for sleep,racing thoughts,increased energy,reckless behavior,,,,,,,,,,,,,,,,,,,,
Mantle Cell Lymphoma,Uncommon,40,80,both,Swollen lymph nodes,fever,weight loss,fatigue,night sweats,,,,,,,,,,,,,,,,,,,,
Marginal Zone Lymphoma,Rare,40,80,both,Enlarged lymph nodes,abdominal pain,fatigue,fever,night sweats,,,,,,,,,,,,,,,,,,,,
"Maroteaux,Lamy Syndrome",Very rare,0,100,both,Short stature,skeletal abnormalities,joint stiffness,enlarged liver,heart valve abnormalities,Enlarged spleen,,,,,,,,,,,,,,,,,,,
Mast Cell Leukemia,Rare,20,80,both,Fatigue,weakness,fever,itching,enlarged liver,bone pain,Enlarged spleen,,,,,,,,,,,,,,,,,,
Mastoidectomy Cavity Infections,Rare,0,100,both,Ear pain,discharge from the ear,fever,headache,swelling behind the ear,,,,,,,,,,,,,,,,,,,,
Measles Vaccination,Common,0,100,both,Injection site soreness,fever,Rash,Joint pain,,,,,,,,,,,,,,,,,,,,,
"Measles,Mumps,Rubella Vaccination",Common,0,100,both,Injection site soreness,fever,Rash,Joint pain,swelling of glands,,,,,,,,,,,,,,,,,,,,
"Measles,Rubella Vaccination",Uncommon,0,100,both,Injection site soreness,fever,Rash,Joint pain,,,,,,,,,,,,,,,,,,,,,
Meconium Aspiration Syndrome,Uncommon,0,100,both,Bluish skin color,difficulty breathing,rapid breathing,grunting sounds,nasal flaring,,,,,,,,,,,,,,,,,,,,
Meconium Ileus,Common,0,100,both,Abdominal distention,failure to pass meconium,vomiting,dehydration,abdominal tenderness,,,,,,,,,,,,,,,,,,,,
Medullary Thyroid Carcinoma,Rare,40,80,both,Thyroid lump,hoarseness,difficulty swallowing,diarrhea,flushing,,,,,,,,,,,,,,,,,,,,
Meibomianitis,Uncommon,0,100,both,Eyelid inflammation,eyelid redness,eyelid swelling,dry eyes,blurry vision,,,,,,,,,,,,,,,,,,,,
Melioidosis,Rare,0,100,both,Fever,Coughing,chest pain,headache,joint pain,,,,,,,,,,,,,,,,,,,,
Meniere's Disease,Uncommon,20,80,both,Vertigo,tinnitus,hearing loss,feeling of fullness in the ear,nausea,,,,,,,,,,,,,,,,,,,,
Meningeal Leukemia,Rare,20,80,both,Fatigue,weakness,bone pain,Excessive bruising,frequent infections,,,,,,,,,,,,,,,,,,,,
Meningitis,Common,0,100,both,Headache,fever,stiff neck,Sensitivity to light (photophobia),confusion,,,,,,,,,,,,,,,,,,,,
Meningitis Due To Anthrax,Rare,0,100,both,Headache,fever,stiff neck,nausea,vomiting,confusion,,,,,,,,,,,,,,,,,,,
Meningitis Due To Bacteroides,Very rare,0,100,both,Headache,fever,stiff neck,nausea,vomiting,confusion,,,,,,,,,,,,,,,,,,,
Meningitis Due To Klebsiella,Very rare,0,100,both,Headache,fever,stiff neck,nausea,vomiting,confusion,,,,,,,,,,,,,,,,,,,
,,,,,,,,,,,,,,,,,,,,,,,,,,,,,
Meningococcal Meningitis,Uncommon,0,100,both,Headache,fever,stiff neck,nausea,vomiting,confusion,rash,sensitivity to,,,,,,,,,,,,,,,,,
Meningococcal Vaccination,Common,0,100,both,Injection site soreness,fever,Rash,Joint pain,,,,,,,,,,,,,,,,,,,,,
Meningococcemia,Rare,0,100,both,Fever,rash,headache,nausea,vomiting,altered mental status,,,,,,,,,,,,,,,,,,,
Meningoencephalitis Due To Naegleria,Very rare,0,100,both,Severe headache,fever,stiff neck,nausea,vomiting,altered mental status,,,,,,,,,,,,,,,,,,,
Menorrhagia,Common,20,80,female,Excessive menstrual bleeding,bleeding between periods,prolonged menstrual periods,fatigue,anemia,,,,,,,,,,,,,,,,,,,,
