Perioperative Hypertension,Common,20,80,both,Elevated blood pressure readings before,during,or after surgery,headache,dizziness,visual changes,chest pain,Shortness of breath,,,,,,,,,,,,,,,,,
Perioperative Mydriasis,Common,20,80,both,Dilated pupils,Sensitivity to light (photophobia),blurry vision,eye discomfort,dryness,or redness.,,,,,,,,,,,,,,,,,,,
Perioperative Tachycardia,Common,20,80,both,Rapid heart rate,during,or after surgery,palpitations,chest discomfort,shortness of breath,dizziness,Rapid heart rate,,,,,,,,,,,,,,,,,
Peripheral Arterial Embolism,Common,40,80,both,Sudden onset of limb pain,coldness,numbness,or weakness,decreased or absent pulses,skin color changes,tissue damage.,,,,,,,,,,,,,,,,,,
Peripheral Arterial Occlusive Disease,Common,40,80,both,Leg pain,cramping,or weakness during physical activity,leg numbness or tingling,paleness,poor wound healing,erectile dysfunction.,,,,,,,,,,,,,,,,,,
,,,,,,,,,,,,,,,,,,,,,,,,,,,,,
Peripheral Edema,Common,0,100,both,Swelling in the legs,ankles,feet,or hands,bloating,skin that retains a dimple after being pressed for several seconds.,,,,,,,,,,,,,,,,,,,
Peripheral Edema Due To Chronic Heart Failure,Common,20,80,both,Swelling in the legs,ankles,feet,or hands,bloating,skin that retains a dimple after being pressed for several seconds,shortness of breath,fatigue,rapid weight gain.,,,,,,,,,,,,,,,,
,,,,,,,,,,,,,,,,,,,,,,,,,,,,,
"Peripheral T,Cell Lymphoma",Rare,20,80,both,Enlarged lymph nodes,fatigue,night sweats,fever,weight loss,Rash,itching,shortness of breath,Coughing,Abdominal Pain,,,,,,,,,,,,,,,
Peripheral Vascular Disease,Common,40,80,both,Leg pain,cramping,or weakness during physical activity,leg numbness or tingling,paleness,poor wound healing,erectile dysfunction.,,,,,,,,,,,,,,,,,,
Peritonitis,Common,0,100,both,Abdominal Pain,tenderness,swelling,fever,nausea,vomiting,diarrhea,decreased urine output,loss of appetite,Fatigue,,,,,,,,,,,,,,,
Pernicious Anemia,Common,20,80,both,Fatigue,weakness,paleness,shortness of breath,dizziness,headache,chest pain,numbness or tingling in the hands and feet.,yellowish skin,,,,,,,,,,,,,,,,
Persistent Pulmonary Hypertension Of The Newborn,Rare,0,1,both,Difficulty breathing,rapid breathing,rapid heart rate,low oxygen levels,cyanosis (bluish discoloration of the skin),lethargy,poor feeding.,,,,,,,,,,,,,,,,,,
Pertussis,Common,0,100,both,Fever,symptoms resemble a common cold,sneezing,coughing,"coughing fits followed by a ""whooping"" sound",vomiting after coughing fits,exhaustion.,,,,,,,,,,,,,,,,,,
Peyronie's Disease,Rare,40,70,male,Curvature of the penis,penile pain,penile plaque or scar tissue,erectile dysfunction,difficulty with intercourse.,,,,,,,,,,,,,,,,,,,,
Pharyngitis,Common,0,100,both,Sore throat,difficulty swallowing,redness and inflammation of the throat,swollen lymph nodes,fever,headache,Fatigue,,,,,,,,,,,,,,,,,,
Pharyngitis Due To Haemophilus Parainfluenzae,Rare,0,100,both,Sore throat,difficulty swallowing,redness and inflammation of the throat,swollen lymph nodes,fever,headache,fatigue,symptoms specifically associated with Haemophilus parainfluenzae infection.,,,,,,,,,,,,,,,,,
Pharyngitis Due To Streptococcus Pyogenes,Common,0,100,both,Sore throat,difficulty swallowing,redness and inflammation of the throat,swollen lymph nodes,fever,headache,fatigue,symptoms specifically associated with Streptococcus pyogenes infection (such as scarlet fever,rash,and strawberry tongue).,,,,,,,,,,,,,,,
Phenylketonuria,Common,0,100,both,Intellectual disability,difficulty swallowing,seizures,behavioral problems,hyperactivity,tremors,"eczema,like rash",musty odor in the urine or sweat.,,,,,,,,,,,,,,,,,
Pheochromocytoma,Rare,20,60,both,High blood pressure,headache,sweating,rapid heartbeat,palpitations,anxiety,tremors,flushing,Abdominal Pain,Weight loss,,,,,,,,,,,,,,,
,,,,,,,,,,,,,,,,,,,,,,,,,,,,,
Philadelphia Chromosome Positive Acute Lymphoblastic Leukemia,Rare,0,100,both,Fatigue,weakness,fever,easy bruising,bone pain,swollen lymph nodes,shortness of breath,pale skin.Easy bleeding,,,,,,,,,,,,,,,,,
Philadelphia Chromosome Positive Chronic Myelocytic Leukemia,Common,40,90,both,Fatigue,weakness,weight loss,abdominal fullness,easy bruising,enlarged spleen,night sweats,Fever,Easy bleeding,,,,,,,,,,,,,,,,
"Philadelphia Chromosome,Negative B,Cell Acute Lymphoblastic Leukemia",Common,0,100,both,Fatigue,weakness,Paleness,fever,easy bruising,bone pain,swollen lymph nodes,Shortness of breath,Easy bleeding,,,,,,,,,,,,,,,,
"Pik3ca,Related Overgrowth Spectrum",Rare,0,100,both,Overgrowth of tissues or organs,asymmetry of body parts,skin abnormalities,vascular malformations,macrodactyly (enlargement of fingers or toes),neurological symptoms.,,,,,,,,,,,,,,,,,,,
Pinta,Rare,0,100,both,Skin lesions,Papules,plaques,depigmentation,hyperpigmentation,,,,,,,,,,,,,,,,,,,,
Pituitary Dwarfism,Rare,0,100,both,Short stature,delayed or absent puberty,delayed development of secondary sexual characteristics,delayed tooth eruption.,,,,,,,,,,,,,,,,,,,,,
Pituitary Function Studies,Common,20,80,both,Various tests to evaluate pituitary function,including blood tests for hormone levels,stimulation tests,and imaging studies such as MRI.,,,,,,,,,,,,,,,,,,,,,
"Pituitary,Dependent Cushing's Disease",Rare,20,60,both,Weight gain,particularly around the face (moon face) and trunk,thinning of the skin,Excessive bruising,muscle weakness,fatigue,high blood pressure,mood swings.,,,,,,,,,,,,,,,,,
Pityriasis Rubra Pilaris,Very rare,0,100,both,Skin redness,scaling,and thickening,particularly on the elbows,knees,hands,and feet,often with islands of unaffected skin.,,,,,,,,,,,,,,,,,
Plague,Rare,0,100,both,Fever,headache,weakness,muscle pain,swollen lymph nodes,Coughing,difficulty breathing,chest pain,Abdominal Pain,nausea,vomiting,diarrhea,gangrene in severe cases.,,,,,,,,,,,,
Plaque Psoriasis,Common,0,100,both,Thick,red patches of skin covered with silvery scales,itching or burning sensation,dry,cracked skin that may bleed,nails thickening or pitting,stiff or swollen joints.,,,,,,,,,,,,,,,,,,
Plasminogen Deficiency Type 1,Very rare,0,100,both,Excessive bleeding,particularly after trauma or surgery,Excessive bruising,nosebleeds,bleeding gums,blood in urine or stool,heavy menstrual periods,Prolonged bleeding,,,,,,,,,,,,,,,,,
Plasmodium Falciparum Malaria,Common,0,100,both,Fever,chills,sweats,headache,nausea,vomiting,muscle pain,fatigue,Yellowing of the skin and eyes (jaundice),confusion,seizures,Coma,joint pain,,,,,,,,,,,,
Plasmodium Falciparum Malaria Prevention,Common,0,100,both,Antimalarial medication use,such as chloroquine,hydroxychloroquine,mefloquine,"or atovaquone,proguanil",before,during,"or after travel to malaria,endemic areas.",,,,,,,,,,,,,,,,,
Plasmodium Malariae Malaria,Uncommon,0,100,both,Recurrent episodes of fever,chills,sweats,headache,muscle pain,fatigue,nausea,vomiting,diarrhea,occurring every few days.,muscle pain,,,,,,,,,,,,,,
,,,,,,,,,,,,,,,,,,,,,,,,,,,,,
,,,,,,,,,,,,,,,,,,,,,,,,,,,,,
,,,,,,,,,,,,,,,,,,,,,,,,,,,,,
,,,,,,,,,,,,,,,,,,,,,,,,,,,,,
,,,,,,,,,,,,,,,,,,,,,,,,,,,,,
"Platelet,Derived Growth Factor Receptor Alpha Exon 18 Mutation(+) Gastrointestinal Stromal Tumor",Very rare,40,80,both,Abdominal Pain,nausea,vomiting,Weight loss,blood in stool,anemia,feeling of fullness or bloating,Fatigue,,,,,,,,,,,,,,,,,
Pleural Empyema,Common,0,100,both,Chest pain,difficulty breathing,Coughing,fever,chills,sweating,malaise,Loss of appetite,Weight loss,,,,,,,,,,,,,,,,
Pleural Malignant Effusion,Rare,20,80,both,Chest pain,difficulty breathing,Coughing,fever,chills,sweating,malaise,Loss of appetite,weight loss,symptoms specific to the underlying malignancy.,,,,,,,,,,,,,,,
Pneumococcal Acute Otitis Media,Common,0,5,both,Ear pain,fever,irritability,difficulty sleeping,Loss of appetite,pulling or tugging at the ears,hearing loss,fluid drainage from the ears.,,,,,,,,,,,,,,,,,
Pneumococcal Infection,Common,0,100,both,Fever,chills,Coughing,chest pain,difficulty breathing,rapid breathing,rapid heart rate,fatigue,headache,muscle pain.,,,,,,,,,,,,,,,
,,,,,,,,,,,,,,,,,,,,,,,,,,,,,
Pneumococcal Meningitis,Very rare,0,100,both,Severe headache,fever,stiff neck,Sensitivity to light (photophobia),nausea,vomiting,confusion,altered mental status,seizures,rash,,,,,,,,,,,,,,,
Pneumococcal Pharyngitis,Common,0,100,both,Sore throat,difficulty swallowing,redness and inflammation of the throat,swollen lymph nodes,fever,headache,Fatigue,,,,,,,,,,,,,,,,,,
Pneumococcal Pneumonia,Common,0,100,both,Coughing,fever,chills,difficulty breathing,chest pain,rapid breathing,rapid heart rate,fatigue,weakness.,,,,,,,,,,,,,,,,
Pneumococcus Endocarditis,Very rare,0,100,both,Fever,chills,weakness,fatigue,shortness of breath,chest pain,new or changed heart murmur,joint pain,red or purple spots on the skin,Weight loss,,,,,,,,,,,,,,,
Pneumocystis Jirovecii Pneumonia,Uncommon,0,100,both,Fever,dry cough,shortness of breath,chest pain,rapid breathing,fatigue,weight loss,Night sweats,,,,,,,,,,,,,,,,,
Pneumocystis Jirovecii Pneumonia Prevention,Uncommon,0,100,both,Prophylactic treatment with antibiotics,"such as trimethoprim,sulfamethoxazole",in individuals at high risk,such as those with HIV/AIDS or undergoing immunosuppressive therapy.,,,,,,,,,,,,,,,,,,,,,
Pneumonia,Common,0,100,both,Coughing,fever,chills,shortness of breath,chest pain,rapid breathing,fatigue,muscle aches,headache,,,,,,,,,,,,,,,,
Pneumonia Due To Klebsiella Pneumoniae,Uncommon,0,100,both,Coughing up blood,fever,chills,shortness of breath,chest pain,rapid breathing,fatigue,Confusion,,,,,,,,,,,,,,,,,
Pneumonia Due To Staphylococcus Aureus,Uncommon,0,100,both,Coughing up blood,fever,chills,shortness of breath,chest pain,rapid breathing,fatigue,muscle aches,headache,,,,,,,,,,,,,,,,
Poisoning Due To Nerve Agent,Very rare,0,100,both,Excessive sweating,blurred vision,headache,Excessive drooling or saliva production,nausea,vomiting,diarrhea,muscle twitching,convulsions,respiratory distress,loss of consciousness.,,,,,,,,,,,,,,
Poisoning Due To Scorpion Venom,Very rare,0,100,both,Pain at the sting site,redness,swelling,numbness or tingling,muscle spasms,difficulty breathing,elevated heart rate,sweating,nausea,vomiting,,,,,,,,,,,,,,,
Poliomyelitis Vaccination,Common,0,100,both,Injection site pain,redness,or swelling,Fever,fatigue,headache,joint pain,irritability.,Muscle pain,,,,,,,,,,,,,,,,
Polyarteritis Nodosa,Rare,20,60,both,Fatigue,fever,weight loss,joint pain,Rash,Abdominal Pain,neuropathy,kidney problems,high blood pressure.,Muscle pain,,,,,,,,,,,,,,,
Polyarticular Juvenile Idiopathic Arthritis,Common,0,18,both,Joint pain,swelling,stiffness,warmth,and redness in affected joints,morning stiffness,fatigue,fever,rash,Weight loss,,,,,,,,,,,,,,,
Polycystic Ovarian Syndrome,Common,15,45,female,Irregular menstrual periods,heavy bleeding,pelvic pain,acne,excess hair growth,weight gain,infertility,insulin resistance,darkening of skin.,,,,,,,,,,,,,,,,
Polycythemia Vera,Rare,40,80,both,Headache,dizziness,weakness,fatigue,itching,redness of the face,shortness of breath,Excessive bruising,enlarged spleen,abdominal pain,,,,,,,,,,,,,,,
Polymorphous Light Eruption,Common,20,80,both,rash,redness,small bumps or blisters,hives,swelling,pain or tenderness,"usually on sun,exposed skin.",,,,,,,,,,,,,,,,,,
Polymyalgia Rheumatica,Common,50,80,female,Muscle pain and stiffness,particularly in the shoulders,neck,hips,and thighs,fatigue,fever,weight loss,depression.,,,,,,,,,,,,,,,,
Polymyositis,Rare,20,80,both,Muscle weakness,particularly in the shoulders,hips,and thighs,difficulty rising from a seated position,fatigue,weight loss,fever,difficulty swallowing,,,,,,,,,,,,,,,,
Porphyria Cutanea Tarda,Uncommon,20,80,both,Skin fragility,"blisters or sores on sun,exposed areas",hyperpigmentation,increased hair growth,scarring,liver enlargement,Abdominal Pain,,,,,,,,,,,,,,,,,,
Post Traumatic Osteoarthritis,Uncommon,0,100,both,Joint pain,stiffness,swelling,decreased range of motion,tenderness,crepitus,and deformity,,,,,,,,,,,,,,,,,,
Post Traumatic Stress Disorder,Common,0,100,both,Flashbacks,nightmares,severe anxiety,uncontrollable thoughts about the traumatic event,avoidance of reminders of the trauma,negative changes in thinking and mood,hyperarousal (e.g.,difficulty sleeping,irritability,hypervigilance).,,,,,,,,,,,,,,,
"Post,Anesthesia Respiratory Depression",Rare,0,100,both,Respiratory depression (e.g.,shallow or slow breathing),confusion,drowsiness,dizziness,weak muscles,bluish lips or fingernails,Slow heart rate,unconsciousness.,,,,,,,,,,,,,,,,
"Post,Exposure Anthrax Prevention",Very rare,0,100,both,Antibiotic treatment (e.g.,ciprofloxacin or doxycycline) in individuals exposed to anthrax spores,vaccination with anthrax vaccine,supportive care.,,,,,,,,,,,,,,,,,,,,,
"Post,Exposure Diphtheria Prevention",Very rare,0,100,both,Antibiotic treatment (e.g.,diphtheria antitoxin) in individuals exposed to diphtheria bacteria,"vaccination with diphtheria toxoid,containing vaccine",supportive care.,,,,,,,,,,,,,,,,,,,,,
"Post,Menopausal Osteoporosis Prevention",Common,50,100,female,Calcium and vitamin D supplementation,bisphosphonate medications (e.g.,alendronate,risedronate),hormone replacement therapy,lifestyle modifications (e.g.,"weight,bearing exercise",smoking cessation,adequate calcium intake).,,,,,,,,,,,,,,,,
"Post,Menopausal Symptoms",Common,50,100,female,Hot flashes,night sweats,mood swings,irritability,fatigue,difficulty sleeping,vaginal dryness,decreased libido,urinary symptoms,joint and muscle pain.,,,,,,,,,,,,,,,
"Post,Op Gynecologic Infection Due To Bacteroides",Very rare,20,80,both,Vaginal discharge with a foul odor,Abdominal Pain,fever,chills,pelvic tenderness,pain during intercourse,burning sensation during urination.,,,,,,,,,,,,,,,,,,
"Post,Op Gynecologic Infection Due To Porphyromonas",Very rare,20,80,both,Vaginal discharge with a foul odor,Abdominal Pain,fever,chills,pelvic tenderness,pain during intercourse,burning sensation during urination.,,,,,,,,,,,,,,,,,,
"Post,Op Gynecologic Infection Due To Prevotella",Very rare,20,80,both,Vaginal discharge with a foul odor,Abdominal Pain,fever,chills,pelvic tenderness,pain during intercourse,burning sensation during urination.,,,,,,,,,,,,,,,,,,
"Post,Op Gynecologic Infection Due To Streptococcus",Very rare,20,80,both,Vaginal discharge with a foul odor,Abdominal Pain,fever,chills,pelvic tenderness,pain during intercourse,burning sensation during urination.,,,,,,,,,,,,,,,,,,
"Post,Op Gynecological Infection Due To E. Coli",Very rare,20,80,both,Vaginal discharge with a foul odor,Abdominal Pain,fever,chills,pelvic tenderness,pain during intercourse,burning sensation during urination.,,,,,,,,,,,,,,,,,,
"Post,Op Gynecological Peptostreptococcus Infection",Very rare,20,80,both,Vaginal discharge with a foul odor,Abdominal Pain,fever,chills,pelvic tenderness,pain during intercourse,burning sensation during urination.,,,,,,,,,,,,,,,,,,
"Post,Op Ocular Inflammation",Very rare,0,100,both,Redness,swelling,pain,or discharge from the eye,blurred vision,Sensitivity to light (photophobia),excessive tearing.,,,,,,,,,,,,,,,,,,
"Post,Op Photophobia",Very rare,0,100,both,Sensitivity to light (photophobia),discomfort or pain in the eyes when exposed to light,squinting,tearing,redness of the eyes.,,,,,,,,,,,,,,,,,,,,
"Post,Operative Nausea And Vomiting",Common,0,100,both,Nausea,vomiting,dizziness,sweating,feeling faint,headache,abdominal pain,,,,,,,,,,,,,,,,,,
"Post,Operative Vaginal Cuff Peptostreptococcus Infection",Very rare,20,80,both,Vaginal discharge with a foul odor,Abdominal Pain,fever,chills,pelvic tenderness,pain during intercourse,burning sensation during urination,specifically after vaginal cuff surgery.,,,,,,,,,,,,,,,,,
"Post,Transplant Cytomegalovirus Infection",Uncommon,0,100,both,Fever,fatigue,weakness,sore throat,swollen glands,muscle aches,joint pain,diarrhea,vomiting,headache,blurred vision,confusion,seizures,pneumonia.,,,,,,,,,,,
Postabortal Hemorrhage,Rare,0,100,both,Heavy bleeding after an abortion,passing large clots,soaking through more than one pad per hour,Abdominal pain,,,,,,,,,,,,,,,,,,,,,
Postcoital Contraception,Common,0,100,both,Emergency contraception use after unprotected intercourse,nausea,vomiting,Abdominal Pain,fatigue,headache,breast tenderness.,,,,,,,,,,,,,,,,,,
Postencephalitic Parkinsonism,Rare,40,90,both,Tremors,rigidity,bradykinesia (slowed movements),postural instability,difficulty with balance and coordination.,,,,,,,,,,,,,,,,,,,,
Posterior Synechiae,Uncommon,0,100,both,Adhesions (abnormal connections) between the iris and the lens or cornea,causing eye discomfort,blurred vision,or vision loss.,,,,,,,,,,,,,,,,,,,,,
Postexposure Plague Prophylaxis,Very rare,0,100,both,Antibiotic treatment with drugs like doxycycline or ciprofloxacin for individuals exposed to Yersinia pestis,supportive care,surveillance for symptoms of plague.,,,,,,,,,,,,,,,,,,,,,,
Postherpetic Neuralgia,Common,40,90,both,Burning,stabbing,or shooting pain in the area where shingles occurred,hypersensitivity to touch,itching,numbness,tingling,muscle weakness.,,,,,,,,,,,,,,,,,
Postmenopausal Osteoporosis,Common,50,100,female,Bone pain,fractures,loss of height over time,stooped posture,back pain,neck pain.,,,,,,,,,,,,,,,,,,,
Postmenopausal Urethral Atrophy,Uncommon,50,100,female,Dysuria (painful urination),unusual urinary urgency and frequency,,recurrent urinary tract infections,vaginal dryness,discomfort during sexual intercourse.,,,,,,,,,,,,,,,,,,,
Postoperative Acute Pain,Common,0,100,both,Pain in the surgical area,tenderness,swelling,limited range of motion,redness,warmth.,,,,,,,,,,,,,,,,,,,
Postoperative Ileus,Common,0,100,both,Abdominal distention,Infrequent bowel movements,abdominal pain,nausea,vomiting,bloating,,,,,,,,,,,,,,,,,,,
Postoperative Ocular Pain,Uncommon,0,100,both,Pain,redness,tearing,foreign body sensation,blurred vision,Sensitivity to light (photophobia),,,,,,,,,,,,,,,,,,,
Postoperative Pain From Cesarean Section,Common,0,100,both,Pain at the incision site,abdominal pain,pain with movement or coughing,tenderness,swelling.,abdominal cramping,,,,,,,,,,,,,,,,,,,
Postoperative Pain From Lower Abdominal Procedure,Common,0,100,both,Pain in the lower abdomen,discomfort with movement,tenderness,swelling,bruising,difficulty sitting or standing.,,,,,,,,,,,,,,,,,,,
Postoperative Pain From Lower Extremity Orthopedic Procedures,Common,0,100,both,Pain in the lower extremities,stiffness,swelling,bruising,difficulty bearing weight or walking.,,,,,,,,,,,,,,,,,,,,
Postpartum Depression,Common,0,100,female,Persistent sadness,anxiety,irritability,changes in appetite,Difficulty sleeping,feelings of guilt or worthlessness,loss of interest in activities,"thoughts of self,harm or harming the baby.",,,,,,,,,,,,,,,,,
Postpartum Endomyometritis Due To Bacteroides,Very rare,20,80,both,Fever,Abdominal Pain,"foul,smelling vaginal discharge",uterine tenderness,pelvic discomfort,fatigue,malaise.,,,,,,,,,,,,,,,,,,
Postpartum Endomyometritis Due To E. Coli,Very rare,20,80,both,Fever,Abdominal Pain,"foul,smelling vaginal discharge",uterine tenderness,pelvic discomfort,fatigue,malaise.,,,,,,,,,,,,,,,,,,
Postpartum Endomyometritis Due To Peptostreptococcus,Very rare,20,80,both,Fever,Abdominal Pain,"foul,smelling vaginal discharge",uterine tenderness,pelvic discomfort,fatigue,malaise.,,,,,,,,,,,,,,,,,,
Postpartum Endomyometritis Due To Porphyromonas,Very rare,20,80,both,Fever,Abdominal Pain,"foul,smelling vaginal discharge",uterine tenderness,pelvic discomfort,fatigue,malaise,,,,,,,,,,,,,,,,,,
Postpartum Endomyometritis Due To Prevotella,Very rare,20,80,both,Fever,Abdominal Pain,"foul,smelling vaginal discharge",uterine tenderness,pelvic discomfort,fatigue,malaise,specifically due to Prevotella infection.,,,,,,,,,,,,,,,,,
Postpartum Endomyometritis Due To Streptococcus,Very rare,20,80,both,Fever,Abdominal Pain,"foul,smelling vaginal discharge",uterine tenderness,pelvic discomfort,fatigue,malaise,,,,,,,,,,,,,,,,,,
Postpartum Hemorrhage,Common,0,100,both,Excessive bleeding after childbirth,soaking through more than one pad per hour,passing large blood clots,low blood pressure,rapid heart rate,fatigue,paleness,,,,,,,,,,,,,,,,,,
Postsurgical Hemorrhage,Common,0,100,both,Excessive bleeding after surgery,low blood pressure,rapid heart rate,dizziness,weakness,fatigue,paleness,,,,,,,,,,,,,,,,,,
Postsurgical Vaginal Cuff Anaerobic Infections,Very rare,20,80,both,Vaginal discharge with a foul odor,Abdominal Pain,fever,chills,pelvic tenderness,pain during intercourse,burning sensation during urination,,,,,,,,,,,,,,,,,,
Posttransfusion Purpura,Very rare,0,100,both,Purple or red spots on the skin (purpura),typically appearing on the lower limbs or trunk,bleeding from the gums,blood in urine or stool,fatigue,weakness.,nosebleeds,,,,,,,,,,,,,,,,,,
"Pre,Exertional Prophylaxis Of Anginal Pain",Common,20,60,both,Chest pain during physical exertion,shortness of breath,fatigue,nausea,sweating,,,,,,,,,,,,,,,,,,,,
"Pre,Existing Hypertension During Pregnancy",Common,20,50,both,Elevated blood pressure readings,headache,vision changes,Abdominal Pain,swelling in the hands and face,shortness of breath,nausea,vomiting,,,,,,,,,,,,,,,,,
"Pre,Menopausal Osteoporosis",Common,20,50,both,Bone pain,fractures,loss of height over time,stooped posture,back pain,neck pain,specifically occurring before menopause.,,,,,,,,,,,,,,,,,,
"Pre,Op Apprehension",Uncommon,20,80,both,Anxiety,nervousness,restlessness,sweating,trembling,rapid heartbeat,shortness of breath,gastrointestinal discomfort.,,,,,,,,,,,,,,,,,
"Pre,Procedure Treatment Of Thrombocytopenia Associated With Chronic Liver Disease",Uncommon,20,80,both,Excessive bruising,bleeding from the gums,blood in urine or stool,petechiae (small red or purple spots on the skin),fatigue,weakness.,Nosebleeds,,,,,,,,,,,,,,,,,,
Precocious Puberty,Uncommon,0,10,both,Development of secondary sexual characteristics (such as breast development in girls or enlargement of testicles in boys),growth spurts,acne,body odor,early onset of menstruation or sperm production.,,,,,,,,,,,,,,,,,,,,
Pregnancy,Common,15,50,female,Missed periods,fatigue,Nausea and vomiting during pregnancy,breast tenderness,frequent urination,mood swings,food cravings or aversions.,,,,,,,,,,,,,,,,,,
Pregnancy Contraception,Common,15,50,female,Nausea,breast tenderness,irregular bleeding or spotting,mood changes,weight gain or loss,Headache,Fatigue,,,,,,,,,,,,,,,,,,
Premature Ejaculation,Common,20,50,male,Inability to delay ejaculation during sexual activity,decreased sexual satisfaction or confidence,distress or frustration related to ejaculatory control.,,,,,,,,,,,,,,,,,,,,,,
Premature Labor,Common,0,100,both,Regular contractions that cause the cervix to open and thin before 37 weeks of pregnancy,vaginal discharge,pelvic pressure,abdominal cramping,backache.,,,,,,,,,,,,,,,,,,,,
Premenopausal Acquired Hypoactive Sexual Desire Disorder,Uncommon,20,50,female,Reduced interest in sexual activity or fantasies,lack of sexual thoughts or desire,reduced responsiveness to sexual cues or stimuli,distress or interpersonal difficulties related to low sexual desire.,,,,,,,,,,,,,,,,,,,,,
Premenstrual Dysphoric Disorder,Common,20,50,female,Severe mood swings,irritability or anger,depressed mood,anxiety or tension,feeling overwhelmed,physical symptoms such as breast tenderness,bloating,joint pain,difficulty sleeping,changes in appetite,,,,,,,,,,,,,,,
Prenatal Treatment Of Methylmalonic Acidemia,Rare,0,18,both,Administration of supplements or medications to manage symptoms and prevent complications associated with methylmalonic acidemia during pregnancy.,,,,,,,,,,,,,,,,,,,,,,,,
Preoperative Anxiety,Common,20,80,both,Restlessness,nervousness,Rapid heart rate,sweating,trembling,gastrointestinal discomfort,specifically before surgery.,,,,,,,,,,,,,,,,,,
Presbyopia,Common,40,60,both,Difficulty focusing on close objects,eyestrain,Headache,needing brighter light for reading,holding reading material at arm's length.,,,,,,,,,,,,,,,,,,,,
,,,,,,,,,,,,,,,,,,,,,,,,,,,,,
,,,,,,,,,,,,,,,,,,,,,,,,,,,,,
,,,,,,,,,,,,,,,,,,,,,,,,,,,,,
,,,,,,,,,,,,,,,,,,,,,,,,,,,,,
,,,,,,,,,,,,,,,,,,,,,,,,,,,,,
,,,,,,,,,,,,,,,,,,,,,,,,,,,,,
,,,,,,,,,,,,,,,,,,,,,,,,,,,,,
,,,,,,,,,,,,,,,,,,,,,,,,,,,,,
,,,,,,,,,,,,,,,,,,,,,,,,,,,,,
,,,,,,,,,,,,,,,,,,,,,,,,,,,,,
,,,,,,,,,,,,,,,,,,,,,,,,,,,,,
,,,,,,,,,,,,,,,,,,,,,,,,,,,,,
,,,,,,,,,,,,,,,,,,,,,,,,,,,,,
,,,,,,,,,,,,,,,,,,,,,,,,,,,,,
,,,,,,,,,,,,,,,,,,,,,,,,,,,,,
,,,,,,,,,,,,,,,,,,,,,,,,,,,,,
,,,,,,,,,,,,,,,,,,,,,,,,,,,,,
,,,,,,,,,,,,,,,,,,,,,,,,,,,,,
,,,,,,,,,,,,,,,,,,,,,,,,,,,,,
,,,,,,,,,,,,,,,,,,,,,,,,,,,,,
,,,,,,,,,,,,,,,,,,,,,,,,,,,,,
,,,,,,,,,,,,,,,,,,,,,,,,,,,,,
,,,,,,,,,,,,,,,,,,,,,,,,,,,,,
,,,,,,,,,,,,,,,,,,,,,,,,,,,,,
,,,,,,,,,,,,,,,,,,,,,,,,,,,,,
,,,,,,,,,,,,,,,,,,,,,,,,,,,,,
,,,,,,,,,,,,,,,,,,,,,,,,,,,,,
,,,,,,,,,,,,,,,,,,,,,,,,,,,,,
,,,,,,,,,,,,,,,,,,,,,,,,,,,,,
,,,,,,,,,,,,,,,,,,,,,,,,,,,,,
,,,,,,,,,,,,,,,,,,,,,,,,,,,,,
,,,,,,,,,,,,,,,,,,,,,,,,,,,,,
,,,,,,,,,,,,,,,,,,,,,,,,,,,,,
,,,,,,,,,,,,,,,,,,,,,,,,,,,,,
,,,,,,,,,,,,,,,,,,,,,,,,,,,,,
,,,,,,,,,,,,,,,,,,,,,,,,,,,,,
,,,,,,,,,,,,,,,,,,,,,,,,,,,,,
,,,,,,,,,,,,,,,,,,,,,,,,,,,,,
,,,,,,,,,,,,,,,,,,,,,,,,,,,,,
,,,,,,,,,,,,,,,,,,,,,,,,,,,,,
,,,,,,,,,,,,,,,,,,,,,,,,,,,,,
,,,,,,,,,,,,,,,,,,,,,,,,,,,,,
,,,,,,,,,,,,,,,,,,,,,,,,,,,,,
,,,,,,,,,,,,,,,,,,,,,,,,,,,,,
,,,,,,,,,,,,,,,,,,,,,,,,,,,,,
,,,,,,,,,,,,,,,,,,,,,,,,,,,,,
,,,,,,,,,,,,,,,,,,,,,,,,,,,,,
,,,,,,,,,,,,,,,,,,,,,,,,,,,,,
,,,,,,,,,,,,,,,,,,,,,,,,,,,,,
,,,,,,,,,,,,,,,,,,,,,,,,,,,,,
,,,,,,,,,,,,,,,,,,,,,,,,,,,,,
,,,,,,,,,,,,,,,,,,,,,,,,,,,,,
,,,,,,,,,,,,,,,,,,,,,,,,,,,,,
,,,,,,,,,,,,,,,,,,,,,,,,,,,,,
,,,,,,,,,,,,,,,,,,,,,,,,,,,,,
,,,,,,,,,,,,,,,,,,,,,,,,,,,,,
,,,,,,,,,,,,,,,,,,,,,,,,,,,,,
,,,,,,,,,,,,,,,,,,,,,,,,,,,,,
,,,,,,,,,,,,,,,,,,,,,,,,,,,,,
,,,,,,,,,,,,,,,,,,,,,,,,,,,,,
,,,,,,,,,,,,,,,,,,,,,,,,,,,,,
